table_name,table_description,refresh_frequency,vertical,partition_column,remarks,relationship_context
hive.code.campaign_snapshot_v3,"data_description: The campaign_snapshot_v3 table stores campaign configuration and metadata information. It contains campaign definitions with associated wallet types and is structured to support campaign management operations. The table includes campaign identifiers, wallet associations, and maintains historical snapshots of campaign configurations. It serves as a reference table for mapping campaigns to their respective wallet types and configurations, with data being captured at regular intervals to maintain historical context.

business_description: This table supports UPI SuperCash and promotional campaign operations by providing essential campaign metadata for business intelligence and reporting. It enables the business to track campaign configurations, associate campaigns with specific wallet types, and analyze campaign performance across different wallet categories. The table is primarily used in conjunction with transaction and task tables to provide comprehensive campaign reporting, supporting business decisions around promotional activities, cashback programs, and UPI payment incentives.",Daily,UPI,dl_last_updated,"The table appears to have minimal column information provided, but the SQL context reveals it contains at least 'wallet' and 'campaign' columns. The 62-day retention pattern in the query suggests this is reference data that doesn't need long-term historical storage. The table is primarily used for lookup operations to enrich campaign transaction data.; The table appears to be a configuration/reference table with limited column information provided. It's primarily used as a lookup table for campaign-wallet mappings in promotional activities. The SQL query shows it's filtered for recent data (62 days) and used in joins with supercash task tables.; The table appears to be a reference/dimension table for campaign metadata, specifically used for mapping campaigns to wallet types. The 62-day retention pattern in queries suggests it maintains recent campaign configurations for operational reporting needs.; The table columns information was not provided in the input, but based on the SQL query context, it contains at least 'wallet', 'campaign', and 'dl_last_updated' fields. The table appears to be a reference/lookup table used for campaign categorization rather than storing transactional data.; This appears to be a configuration/metadata table with relatively small data volume, used primarily for lookup operations. The v3 suffix suggests this is an evolved version of the table schema. The 62-day retention window in the query indicates data is kept for approximately 2 months for operational purposes.; This appears to be a reference/lookup table that provides wallet information for campaigns. The table is used as a dimension table in joins to enrich campaign transaction data with wallet details. The 62-day retention period suggests regular cleanup of older campaign configurations.","This table serves as a lookup/reference table that is joined with hive.promocard.supercash_task_snapshot_v3 to provide campaign metadata (particularly wallet information) for supercash transactions. The relationship is established through the campaign field, enabling enrichment of transactional data with campaign configuration details. It's commonly used in left joins to add campaign metadata to transaction-level analysis and reporting.; This table has a direct relationship with hive.promocard.supercash_task_snapshot_v3, joined on the campaign field to provide wallet information for promotional campaigns. It serves as a dimension table that enriches transaction-level data with campaign metadata. The table is commonly used in left joins to supplement campaign analysis with wallet configuration details, enabling comprehensive reporting on UPI SuperCash promotional activities and cash burn analysis.; This table serves as a reference table that is commonly joined with hive.promocard.supercash_task_snapshot_v3 to provide wallet context for promotional campaigns. It acts as a bridge table connecting campaign identifiers with wallet information, enabling comprehensive reporting on promotional activities. The table is typically used in left joins where the campaign field serves as the join key, providing wallet metadata for supercash and promotional tracking queries.; This table has a direct relationship with hive.promocard.supercash_task_snapshot_v3, serving as a dimension table that provides campaign metadata for transactional SuperCash data. It's joined on the campaign field to enrich task records with wallet type information. The table likely serves as a central reference for various campaign-related analyses and is essential for proper categorization and reporting of UPI SuperCash campaigns across different wallet types.; This table serves as a lookup/dimension table that is commonly joined with transactional tables like supercash_task_snapshot_v3. The primary join key is the 'campaign' field, which links campaign metadata to specific promotional activities and tasks. It provides essential context for campaign-related analysis by mapping campaigns to wallet types, enabling comprehensive reporting on UPI promotional activities across different wallet categories. The table is typically used in left joins to enrich transactional data with campaign configuration details.; This table serves as a lookup/reference table that is commonly joined with transactional tables like hive.promocard.supercash_task_snapshot_v3 based on the 'campaign' field. It provides campaign metadata enrichment for promotional campaign analysis. The table is typically used in left joins to add wallet type classification to campaign transactions, enabling business reporting on campaign performance across different wallet categories in the UPI ecosystem."
hive.promocard.supercash_task_snapshot_v3,"data_description: This table contains detailed transaction records for SuperCash promotional tasks and rewards. It stores comprehensive information about each supercash transaction including user identification, transaction status (1=active, 2=inactive), fulfillment status (1=pending, 2=processing, 3=given), monetary amounts, redemption types (coins, goldcoins, upi), campaign associations, and additional metadata stored in JSON format. The table tracks the complete lifecycle of supercash rewards from creation through fulfillment, with timestamps for creation and updates. Key data categories include transaction identifiers, user demographics, financial amounts, status tracking, campaign references, and scratch card information extracted from JSON fields.

business_description: This table supports UPI SuperCash promotional campaigns and reward management operations. It enables businesses to track the burn rate and utilization of promotional supercash rewards across different redemption channels (UPI, coins, gold coins). The table is used for campaign performance analysis, user engagement measurement, financial reconciliation of promotional expenses, and operational monitoring of reward fulfillment processes. It supports business intelligence dashboards that track daily active users, cash burn metrics, campaign effectiveness, and helps in making data-driven decisions about promotional strategies and budget allocation for customer acquisition and retention programs.",Daily,UPI,dl_last_updated,"The table uses JSON extraction for scratch card details and implements complex cash burn calculations based on redemption type. Status mapping logic suggests a sophisticated workflow management system. The ""_v3"" suffix indicates this is likely the third iteration of the table schema, suggesting ongoing evolution of the data model.; The table uses a versioned naming convention (v3) suggesting active development and iterations. JSON fields in 'info' column store additional metadata like scratchCardId and scratched status. The SQL shows complex business logic for calculating actual cashburn based on redemption types with different conversion rates.; The table appears to be a versioned snapshot table (v3) indicating it has undergone schema evolution. The JSON info field contains scratch card details, and the query shows complex status mapping logic for different fulfillment states. The cashback burn calculation varies by redemption type with specific conversion rates.; This is a snapshot table (v3) indicating it's likely the third version of the schema. The table includes complex JSON extraction for scratch card details and sophisticated cashburn calculations based on redemption types. The query patterns suggest it's primarily used for monthly and daily reporting with date-based filtering being common.; This is a versioned snapshot table (v3) indicating schema evolution. The table includes complex business logic for cash burn calculations with different conversion rates based on redemption types. JSON fields suggest flexible metadata storage for campaign-specific information. The query patterns show month-to-date analysis capabilities with sophisticated status mapping logic.; Table appears to be version 3 of the supercash task snapshot, suggesting iterative improvements. The complex cash burn calculation logic indicates sophisticated business rules for different redemption types. The JSON info field containing scratch card data suggests integration with gamification features.","This table has a direct relationship with hive.code.campaign_snapshot_v3 through the campaign field, enabling analysis of campaign-specific redemption patterns. It likely relates to user tables through user_id for demographic analysis, and potentially to transaction tables for reconciliation. The table serves as a central source for SuperCash redemption tracking and is commonly joined with campaign tables to analyze promotional effectiveness and with wallet/payment tables for financial reconciliation.; This table has a direct relationship with hive.code.campaign_snapshot_v3 through the campaign field, enabling wallet and campaign metadata enrichment. The join pattern suggests it's commonly used alongside campaign configuration tables to provide complete promotional context. The table likely serves as a source for aggregated reporting tables and is joined with user and transaction tables for comprehensive cashback analytics. It appears to be a central table in the UPI promotional ecosystem, feeding data to various downstream reporting and reconciliation processes.; This table has a left join relationship with hive.code.campaign_snapshot_v3 table on the campaign field to retrieve wallet information. It's likely part of a broader ecosystem of promocard and campaign management tables. The table serves as a source for campaign performance analytics and integrates with wallet and payment processing systems. It may also relate to user profile tables through user_id for comprehensive customer analysis.; This table has a key relationship with hive.code.campaign_snapshot_v3 through the campaign field, enabling campaign-level analysis and wallet association. It's likely joined with user tables for demographic analysis and payment tables for transaction correlation. The table serves as a fact table in reward analytics, commonly joined with dimension tables for campaign, user, and temporal analysis. It's frequently used in conjunction with other promocard schema tables for comprehensive reward program reporting and is essential for cross-referencing reward activities with actual payment transactions.; This table has a direct relationship with hive.code.campaign_snapshot_v3 through the campaign field, which provides wallet and campaign configuration details. The join pattern suggests this table serves as a transaction detail layer while campaign_snapshot_v3 provides campaign metadata. The table is likely part of a larger promotional ecosystem that includes user management, campaign management, and financial reconciliation systems. It appears to be a central table for tracking promotional reward transactions across various UPI-related campaigns and is commonly used with campaign configuration tables for comprehensive reporting and analysis.; This table has a clear relationship with hive.code.campaign_snapshot_v3 through the campaign field, which provides wallet information for campaigns. The join pattern suggests this table focuses on task-level details while the campaign table provides campaign-level metadata. It's likely joined with user tables for demographic analysis and potentially with transaction tables for validation of redemption activities. The table serves as a central source for promotional task tracking and is commonly used in conjunction with campaign configuration tables."
burn,"data_description: The burn table is a derived dataset that contains comprehensive information about SuperCash campaign redemptions and reward distributions. It includes user redemption activities with detailed status tracking (Given, Processing, Unscratched, Pending), redemption amounts, redemption types (coins, goldcoins, UPI), and calculated cash burn values. The table incorporates timestamp information for tracking when records were created and last updated, campaign identifiers, user IDs, fulfillment status codes, and additional metadata extracted from JSON fields including scratch card information. The cash burn calculation applies different conversion rates based on redemption type to normalize monetary impact.

business_description: This table serves as a critical business intelligence asset for monitoring and analyzing UPI SuperCash promotional campaign performance. It enables business teams to track campaign effectiveness by measuring user engagement, redemption rates, and actual cash burn across different wallet providers and redemption channels. The table supports financial reporting by providing accurate burn calculations for budget tracking and ROI analysis of promotional campaigns. It facilitates operational monitoring of campaign fulfillment processes, helping identify bottlenecks in reward distribution and user experience issues. Business stakeholders use this data for campaign optimization, budget forecasting, and strategic decision-making around promotional offers in the UPI ecosystem.",Daily,UPI,dl_last_updated,"Table appears to be a snapshot table (indicated by naming pattern and dl_last_updated field). Contains complex business logic for status mapping and amount calculations based on redemption types. The JSON info field suggests flexible metadata storage for campaign-specific attributes like scratch cards.; This appears to be a derived table created through complex business logic rather than a base table. The query shows sophisticated cashburn calculations with different rates for different redemption types. The table includes scratch card functionality and campaign-based tracking, indicating this is part of a gamified rewards system.; This appears to be a derived table or CTE rather than a physical table. The actual source table is hive.promocard.supercash_task_snapshot_v3. The table includes complex business logic for cash burn calculations with different multipliers for various redemption types. Status mapping logic converts numeric codes into meaningful business statuses. The query includes month-over-month analysis capabilities and campaign filtering options.; The table name ""burn"" is quite generic and could benefit from a more descriptive naming convention. The SQL shows complex status logic and multiple redemption type calculations, suggesting this is a critical table for financial tracking. The query includes campaign filtering and wallet mapping, indicating integration with broader promotional campaign systems.; Table appears to be a snapshot table (indicated by _snapshot_v3 suffix) with complex business logic for status categorization and cash burn calculations. Contains JSON fields for additional metadata storage and supports multiple redemption types with different conversion rates.; This appears to be a derived table created through CTE (Common Table Expression) rather than a physical table. The cash burn calculation includes specific conversion rates for different redemption types (coins: amount/166.67, goldcoins: amount/100, UPI: amount+0.2478). The table includes JSON parsing for extracting scratch card metadata, indicating a gamification component in the SuperCash campaigns.","The burn table is derived from two primary source tables: `hive.promocard.supercash_task_snapshot_v3` (main transaction data) and `hive.code.campaign_snapshot_v3` (campaign metadata including wallet information). It serves as an intermediary analytical layer that joins campaign transaction data with campaign configuration data. This table likely feeds into dashboard visualizations and reporting systems for campaign performance monitoring. It may have relationships with user dimension tables, wallet provider tables, and financial reporting aggregations. The table is commonly used in left joins to enrich campaign data with wallet provider context and is filtered by date ranges for period-specific analysis.; The burn table is derived from hive.promocard.supercash_task_snapshot_v3 as the primary source and joined with hive.code.campaign_snapshot_v3 to enrich with wallet/campaign information. It serves as an intermediate analytical layer for UPI SuperCash reporting and likely feeds into higher-level dashboards and financial reports. The table relationships center around campaign tracking and user reward fulfillment processes.; The burn table is derived from hive.promocod.supercash_task_snapshot_v3 as the primary source and joins with hive.code.campaign_snapshot_v3 to enrich campaign data with wallet information. It's commonly used in conjunction with campaign tables for performance analysis and likely relates to user tables for demographic analysis. The table serves as an intermediate layer for UPI promotional analytics, connecting raw transaction data with campaign metadata and user engagement metrics. It's frequently filtered by date ranges and campaign IDs for specific promotional analysis.; This table joins with hive.code.campaign_snapshot_v3 to enrich burn records with campaign wallet information. The relationship is established through the campaign field, providing context about which wallet/program the burn activity belongs to. This suggests the burn table is part of a larger ecosystem involving campaign management, user rewards, and wallet systems for UPI SuperCash programs.; The burn table joins with hive.code.campaign_snapshot_v3 table on campaign field to retrieve wallet information, indicating a relationship with campaign management systems. It likely relates to user tables through user_id for user profiling and engagement analysis. The table serves as a fact table in reward analytics, commonly joined with campaign, user, and wallet dimension tables for comprehensive reward program reporting and analysis.; This table has a relationship with hive.code.campaign_snapshot_v3 through the campaign field, enabling wallet and campaign metadata enrichment. It appears to be part of a larger UPI rewards ecosystem where campaigns drive user tasks that result in cashback burns. The table likely connects to user tables through user_id and may have downstream relationships with financial reconciliation and reporting tables. Common joins would be on campaign for campaign details and user_id for user-specific analytics."
