table_name,column_name,variable_type,column_description,required_flag
hive.user_paytm_payments.upi_3p_online_merchant_vpa_mapping,flow_category,,"Categorizes different types of UPI payment flows for third-party online merchants, used to segment transaction patterns and performance metrics in payment analytics dashboards.",no
hive.user_paytm_payments.upi_3p_online_merchant_vpa_mapping,payer_handle,,"A UPI (Unified Payments Interface) handle or identifier that uniquely identifies a payer in third-party online merchant transactions, used for mapping payers to merchants in payment analytics.",no
hive.user_paytm_payments.upi_3p_online_merchant_vpa_mapping,status,,"The status column likely represents the current state or condition of UPI merchant VPA mapping records in the system, though it appears to be unused in the current dashboard analytics that focus on merchant performance metrics.",no
hive.user_paytm_payments.upi_3p_online_merchant_vpa_mapping,transaction_date_key,,"A date key that represents the transaction date used for temporal analysis and filtering of UPI 3rd party online merchant payment data. This column enables time-based aggregations and comparisons across different periods like daily, weekly, and monthly metrics in business intelligence dashboards.",yes
hive.user_paytm_payments.upi_3p_online_merchant_vpa_mapping,transaction_type,,"Categorizes the type of UPI transaction or payment method used by third-party online merchants, helping to classify and analyze different transaction patterns in the merchant VPA mapping system.",no
hive.user_paytm_payments.rolling_nrr_v1,users_lmtd,,"Stores the count of users for the Last Month To Date (LMTD) period, representing the number of users who made transactions during the equivalent time frame in the previous month. This metric is used for calculating month-over-month user growth comparisons in Paytm payment analytics.",no
hive.user_paytm_payments.rolling_nrr_v1,users_mtd,,"Contains the count of unique users who completed transactions within the current month-to-date period, used for tracking user engagement and calculating key business metrics like transactions per user and month-over-month user growth rates.",no
hive.user_paytm_payments.upi_abhay,amount,double,"The transaction amount in monetary value for UPI payments, used to calculate Gross Merchandise Value (GMV) metrics including month-to-date and growth comparisons in business dashboards.",no
hive.user_paytm_payments.upi_abhay,gmv_lmtd,,"Represents the Gross Merchandise Value (total transaction amount) for the Last Month To Date period in UPI payments, used to calculate month-over-month growth metrics by comparing current MTD performance against the equivalent period in the previous month.",no
hive.user_paytm_payments.upi_abhay,gmv_mtd,,Represents the total Gross Merchandise Value (GMV) accumulated from the beginning of the current month to date for UPI payment transactions. This metric is used to track monthly revenue performance and calculate month-over-month GMV growth rates in payment analytics dashboards.,no
hive.user_paytm_payments.upi_abhay,txn_id,varchar,Unique identifier for each UPI transaction processed through Paytm's payment system. This varchar field serves as the primary key to distinguish individual payment transactions within the UPI transaction dataset.,yes
hive.user_paytm_payments.upi_abhay,txns_lmtd,,"Represents the total number of UPI transactions for the Last Month To Date (LMTD) period, used for calculating month-over-month transaction growth and transactions per user metrics in payment analytics dashboards.",no
hive.user_paytm_payments.upi_abhay,txns_mtd,,"Month-to-date transaction count representing the total number of UPI transactions processed from the beginning of the current month up to the current date, used for calculating key business metrics like transactions per user and period-over-period growth analysis.",no
hive.user_paytm_payments.top1000_merchnats_nov_dec_and_offeractive_ss,updated_on,,"Timestamp indicating when the merchant record was last updated in the top 1000 merchants analysis table, used for tracking data freshness and ensuring current offer activity status.",yes
hive.user_paytm_payments.upi_3p_online_merchant_vpa_mapping_V1,day_id,,"A date identifier column that represents the daily time dimension for UPI merchant transaction analysis, enabling daily-level aggregation and trending of Monthly Transacting Users (MTU) metrics across different merchant categories including live merchants, top-tier merchants, and overall merchant populations.",yes
hive.user_paytm_payments.upi_3p_online_merchant_vpa_mapping_V1,final_category,,"Categorizes UPI merchants into predefined segments (Live Merchants, Top 15, Top 1K, Non-Live, Overall) for Monthly Transacting Users (MTU) analysis and business performance tracking.",no
hive.user_paytm_payments.upi_3p_online_merchant_vpa_mapping_V1,mnt,,"A date/time column that represents the month or time period for tracking UPI merchant transaction data. This column serves as the primary temporal dimension for analyzing Monthly Transacting Users (MTU) metrics across different merchant categories including live merchants, top-tier merchants, and overall transaction volumes.",no
hive.user_paytm_payments.upi_3p_online_merchant_vpa_mapping_V1,online_merchant_name,varchar,"Contains the name of the online merchant involved in UPI transactions, used primarily for categorizing merchants into different tiers (Live, Top 15, Top 1K) for Monthly Transacting User (MTU) analysis and performance tracking.",no
hive.user_paytm_payments.upi_3p_online_merchant_vpa_mapping_V1,payee_vpa,varchar,"Virtual Payment Address (VPA) of the payee/recipient in UPI transactions, primarily used to identify and categorize merchants for Monthly Transacting User (MTU) analysis across different merchant tiers and business segments.",no
hive.user_paytm_payments.upi_3p_online_merchant_vpa_mapping_V1,payer_cust_id,,"Unique identifier for the customer making the payment transaction, used to calculate Monthly Transacting Users (MTU) metrics across different merchant categories in UPI payment analytics.",yes
hive.user_paytm_payments.upi_3p_online_merchant_vpa_mapping_V1,updated_on,date,A date field that tracks when the UPI merchant VPA mapping record was last updated or modified. This column is used for temporal analysis and filtering of merchant transaction data across different time periods in MTU reporting.,yes
hive.user_paytm_payments.upi_abhay,mnt,,A timestamp column representing the date dimension used for aggregating Monthly Transacting User (MTU) metrics across different merchant categories and payment scenarios. This column serves as the primary time grouping field for analyzing user transaction patterns and merchant performance over time.,no
hive.user_paytm_payments.upi_abhay,updated_on,,"Timestamp indicating when the UPI payment transaction record was last updated, used for temporal analysis and date-based grouping in merchant transacting user (MTU) calculations.",yes
