table_name,table_description,refresh_frequency,vertical,partition_column,remarks,relationship_context
hive.user_paytm_payments.mapper,"data_description: This is a UPI campaign mapping/reference table that stores campaign metadata and categorization information. The table contains campaign identifiers, campaign types, customer associations, and date information. It serves as a lookup table to map raw campaign type codes to business-friendly feature categories through complex categorization logic. The table structure supports campaign tracking with fields like customer_id, campaign_id, campaign_type, and date (dt), enabling campaign performance analysis and funnel metrics calculation.

business_description: This table is used in UPI growth marketing operations to categorize and track various UPI feature adoption campaigns. It supports campaign performance dashboards by providing the mapping logic to group different campaign types into meaningful business categories such as Bank Linking, Mapper services, RuPay CC Linking, CC Spends, UPI Lite features, and various widget promotions. Business teams use this table to analyze campaign effectiveness across different UPI feature categories, track conversion funnels from impression to same-day conversions, and measure the success of growth initiatives targeting specific UPI functionalities.",Daily,UPI,dt,"The table appears to be incomplete in the column information provided, but the SQL context reveals it contains campaign mapping logic with extensive categorization rules. The query shows sophisticated campaign type transformation suggesting this is a critical reference table for UPI campaign analytics.; The table appears to be a foundational mapping table in the UPI ecosystem. Column details are not provided, but based on usage context, it likely contains customer_id and dt as core columns. The table is used alongside multiple other UPI feature tables in union operations for comprehensive feature adoption tracking.; Limited column information available, but the table appears to be a critical component in UPI growth campaign tracking. The SQL context suggests it's used as a reference table in complex queries that measure campaign performance and customer conversion metrics.; Table has empty column metadata provided, but based on SQL context, it contains at minimum customer_id and dt fields. Used as part of a larger customer activity union query for campaign tracking.","This table is part of a collection of payment-related tables used together in UNION operations to create comprehensive customer activity datasets. It commonly joins with tables like bank_link, cc_all_linkages, lite_active, upi_statement_download_V1, and widget tables. The relationship pattern shows it's used to aggregate different types of customer activities (Bank Linking, Mapper, RuPay CC Linking, UPI Lite Activation, etc.) into unified customer journey analysis. The table serves as one data source in multi-table customer activity tracking queries for growth campaign analytics.; This table serves as a mapping/reference table that's commonly joined with other UPI-related tables including hive.user_paytm_payments.bank_link, hive.user_paytm_payments.cc_all_linkages, hive.user_paytm_payments.lite_active, and featurehub.enterprise.UPI_FeatureAdoption_Olap_Daily_v3. It's typically used in UNION ALL operations to consolidate customer data across different UPI services and features, enabling comprehensive campaign performance analysis and customer journey tracking across the UPI ecosystem.; This table is closely related to other UPI feature tables in the user_paytm_payments schema including bank_link, cc_all_linkages, lite_active, upi_statement_download_V1, and widget_added_rec_money_ER_daily. It's commonly used in UNION ALL operations with these tables to create comprehensive UPI feature adoption reports. The table serves as a core component in multi-table joins for UPI growth analysis, with relationships typically established through customer_id and date-based filtering for time-series analysis.; This mapper table likely serves as a reference table that joins with campaign event tables, customer tables, and campaign performance metrics tables. It's commonly joined on campaign_id and customer_id fields to enrich raw campaign event data with business-friendly category mappings. The table enables aggregation and analysis across campaign categories rather than individual campaign types, making it essential for campaign performance dashboards and UPI growth analytics reporting."
hive.user_paytm_payments.bank_link,"data_description: The bank_link table contains campaign performance data for UPI (Unified Payments Interface) related initiatives, specifically focusing on bank account linking and various UPI feature adoption campaigns. The table stores metrics across different campaign types including bank linking campaigns (UPI_P2P_ADD_BANK_ACCOUNT, UPI_MULTI_BANK_ACCOUNT_LINKING), mobile mapper campaigns, RuPay credit card linking, UPI Lite activation, and various UPI feature promotions. Key data points include customer interactions (sent, impressions, clicks) and conversion metrics tracked on a daily basis with campaign-specific identifiers and feature type classifications.

business_description: This table supports UPI growth initiatives by tracking the effectiveness of various promotional campaigns aimed at increasing UPI adoption and feature utilization. It enables business teams to monitor campaign performance across different UPI features like bank account linking, mobile number mapping, credit card integration, and new feature rollouts. The data is used for measuring campaign ROI, optimizing marketing strategies, understanding user engagement patterns, and making data-driven decisions for UPI product growth. Business stakeholders can analyze conversion funnels, compare campaign effectiveness across different UPI features, and track same-day conversion rates to assess immediate campaign impact.",Daily,UPI,dt,"The table appears to be part of a comprehensive UPI campaign tracking system. The SQL query shows sophisticated campaign type categorization logic that maps various UPI campaign types into business-friendly feature categories. The table structure supports detailed funnel analysis from campaign sent through to same-day conversions.; The table columns information is empty in the provided input, but the SQL context reveals the table contains at least customer_id and dt fields. The table is part of a larger ecosystem of UPI-related tables used for comprehensive conversion tracking across multiple user actions.; Table columns information was not provided, but based on SQL context, it contains at minimum customer_id and dt fields. This appears to be a core table in the UPI user journey tracking system.; This table is part of a larger ecosystem of UPI feature tracking tables within the user_paytm_payments schema. The SQL context shows it's consistently used with date range filters for month-over-month analysis, indicating its importance in campaign performance measurement.","This table is closely integrated with other UPI-related tables in the user_paytm_payments schema, including mapper, cc_all_linkages, lite_active, upi_statement_download_V1, widget tables, spend_analytics, and lite_auto_topup. It's commonly used in UNION operations to create comprehensive user activity views across different UPI features. The table joins with user mapping tables via customer_id and is often filtered by date ranges for campaign analysis. It serves as a foundational table for tracking user progression through the UPI activation funnel and is frequently combined with other tables to analyze user engagement patterns and conversion rates across different UPI features.; This table is commonly joined with other UPI feature tables including mapper, cc_all_linkages, lite_active, upi_statement_download_V1, and widget_added_rec_money_ER_daily to create comprehensive feature adoption reports. It's typically unioned with these tables using customer_id and dt as common fields to track overall UPI feature engagement. The table serves as a foundational dataset in the user journey analysis, as bank linking is often a prerequisite for other UPI features.; This table is closely integrated with other UPI ecosystem tables including hive.user_paytm_payments.mapper, hive.user_paytm_payments.cc_all_linkages, hive.user_paytm_payments.lite_active, and featurehub.enterprise.UPI_FeatureAdoption_Olap_Daily_v3. It's commonly joined or unioned with these tables using customer_id as the key identifier and dt for temporal alignment. The table serves as one component in a multi-table union structure that tracks various user conversion events in the UPI growth funnel, enabling comprehensive campaign performance analysis across different user engagement touchpoints.; This table likely joins with customer dimension tables using customer_id, campaign management tables using campaign_id, and potentially other UPI transaction tables to correlate campaign performance with actual UPI usage. It may be used alongside other campaign performance tables and UPI adoption metrics tables to provide a comprehensive view of UPI growth initiatives. The table supports time-series analysis through the dt (date) partition and enables cross-campaign comparisons through campaign_id and feature_type dimensions."
ftr,"data_description: The 'ftr' table is a derived dataset that consolidates UPI feature adoption data across multiple feature categories. It contains aggregated information about customer interactions with various UPI features including bank linking, mapper functionality, RuPay credit card linking, UPI Lite activation, statement downloads, and widget usage (Receive Money and Scan & Pay widgets). The table structure includes customer IDs, feature types, and date information, allowing for temporal analysis of feature adoption patterns. Each row represents a customer's engagement with a specific UPI feature on a particular date.

business_description: This table serves as a comprehensive tracking mechanism for UPI growth campaigns, enabling business teams to monitor and analyze the adoption rates of different UPI features. It supports campaign effectiveness measurement, user engagement analysis, and feature performance evaluation. Business stakeholders use this data to understand which UPI features are gaining traction, identify growth opportunities, and make data-driven decisions about feature promotion and development priorities. The table is particularly valuable for product managers, marketing teams, and growth analysts who need to track the success of UPI feature rollouts and campaigns.",Daily,UPI,dt,"This appears to be a derived table or CTE created by combining data from multiple source tables in the user_paytm_payments schema. The SQL query was truncated but shows union operations combining various UPI feature datasets. The table supports month-over-month and day-over-day analysis as indicated by the dashboard chart requirements.; This is a CTE (Common Table Expression) rather than a physical table. The table_columns field is empty because it's dynamically constructed from multiple source tables. The CTE unions data from 8 different UPI feature tables, standardizing them into a common schema with type, custid, and dt fields.; This appears to be a CTE (Common Table Expression) rather than a physical table, used for real-time aggregation of UPI conversion metrics. The query shows a 4-day rolling window for data analysis, suggesting near real-time campaign performance tracking requirements.","The 'ftr' CTE acts as a central aggregation layer that combines data from multiple UPI-related tables including hive.user_paytm_payments.bank_link, hive.user_paytm_payments.cc_all_linkages, hive.user_paytm_payments.lite_active, and featurehub.enterprise.UPI_FeatureAdoption_Olap_Daily_v3. It creates a unified view for campaign conversion analysis by standardizing different UPI activities into a common format with type, customer_id, and date fields. This enables downstream analysis of campaign impressions and clicks correlation with actual UPI feature adoption.; The 'ftr' CTE depends on multiple upstream tables from the hive.user_paytm_payments schema including bank_link, mapper, cc_all_linkages, lite_active, upi_statement_download_V1, widget_added_rec_money_ER_daily, widget_added_snp_ER_daily, spend_analytics, and lite_auto_topup. It serves as a unified interface for campaign tracking systems and is likely joined with banner impression and conversion tracking tables to measure growth campaign effectiveness. This CTE enables comprehensive analysis of UPI feature adoption patterns across the user base.; The 'ftr' table is derived from multiple source tables in the hive.user_paytm_payments schema including bank_link, mapper, cc_all_linkages, lite_active, upi_statement_download_V1, and widget_added_rec_money_ER_daily tables. It serves as a consolidated view that joins data from these feature-specific tables using UNION ALL operations. The table is commonly used in dashboard queries that require aggregated feature adoption metrics, often joined or grouped by date dimensions (dt) and feature types to support time-series analysis and comparative feature performance reporting."
hive.user_paytm_payments.cc_all_linkages,"data_description: This table contains comprehensive campaign tracking data for UPI (Unified Payments Interface) marketing initiatives, specifically focused on credit card linking campaigns and related UPI features. The table stores campaign interaction events including customer engagement metrics across the conversion funnel - from campaign sends and impressions to clicks and same-day conversions. It includes various UPI campaign types such as bank account linking, mobile number mapping, RuPay credit card linking and activation, UPI Lite features, statement downloads, and widget promotions. The data is structured with customer identifiers, campaign details, timestamps, and engagement metrics to enable comprehensive campaign performance analysis.

business_description: This table serves as the primary data source for tracking and analyzing UPI growth marketing campaigns, particularly those aimed at increasing credit card linkage adoption and UPI feature utilization. Business teams use this data to monitor campaign effectiveness, measure conversion rates across different UPI features, and optimize marketing strategies for driving UPI ecosystem growth. The table supports campaign performance dashboards, ROI analysis, customer journey tracking, and A/B testing for various UPI promotional activities. It enables product and marketing teams to understand which campaign types drive the highest engagement and conversions, helping prioritize future campaign investments and feature development efforts.",Daily,UPI,dt,"This table is part of a larger UPI feature tracking ecosystem and is specifically used for monitoring RuPay credit card linking adoption. The table is queried alongside multiple other payment feature tables in a union structure, indicating it follows a standardized schema pattern with other feature tracking tables in the user_paytm_payments database.; This table is part of a comprehensive UPI features tracking system that includes multiple feature types (bank linking, mapper, RuPay CC linking, UPI Lite, statements, widgets). The SQL context shows it's used in month-over-month and day-over-day analysis for campaign tracking purposes.; Table appears to be part of a larger UPI feature adoption tracking framework. The SQL context shows it's specifically used for RuPay CC Linking tracking within a comprehensive campaign measurement system. Column details are not provided in the input, but usage pattern suggests customer_id and dt are key fields based on the query structure.; The table appears to be specifically focused on credit card linking campaigns within the broader UPI ecosystem, as indicated by the ""cc_all_linkages"" naming. The SQL shows extensive campaign type categorization logic, suggesting this is a well-structured campaign tracking system with standardized campaign classifications.","This table is closely integrated with other UPI feature tracking tables including hive.user_paytm_payments.bank_link, hive.user_paytm_payments.mapper, hive.user_paytm_payments.lite_active, and featurehub.enterprise.UPI_FeatureAdoption_Olap_Daily_v3. It's commonly joined in UNION operations to create comprehensive feature adoption datasets. The table shares common schema patterns with other payment tracking tables, using customer_id as a key join field and dt for temporal analysis. It's frequently used in campaign performance dashboards alongside CLM impression and conversion data to measure end-to-end campaign effectiveness from awareness to actual feature adoption.; This table is commonly joined with other UPI feature tracking tables in union operations, specifically with bank_link, mapper, lite_active, upi_statement_download_V1, and widget_added_rec_money_ER_daily tables. It shares a similar schema pattern with customer_id and dt columns that enable consistent aggregation across different UPI features. The table is typically used in analytical queries that combine multiple feature adoption metrics to provide comprehensive UPI growth insights and campaign performance tracking.; This table is closely integrated with other UPI feature tables including bank_link, mapper, lite_active, upi_statement_download_V1, widget_added_rec_money_ER_daily, widget_added_snp_ER_daily, spend_analytics, and lite_auto_topup. All these tables are commonly joined or unioned together using customer_id and date fields to create comprehensive user journey analysis for UPI growth campaigns. The table serves as one component in a multi-feature tracking system where customer actions across different payment functionalities are aggregated to measure overall UPI adoption and engagement metrics.; This table likely joins with customer dimension tables using customer_id, campaign master tables using campaign_id, and may be aggregated with other UPI transaction tables to correlate campaign engagement with actual usage behavior. It's commonly used in conjunction with UPI transaction fact tables to measure the effectiveness of campaigns in driving actual payment activity. The table may also relate to user segmentation tables to analyze campaign performance across different customer cohorts and demographics."
hive.user_paytm_payments.lite_active,"data_description: The hive.user_paytm_payments.lite_active table contains campaign performance data for UPI (Unified Payments Interface) marketing initiatives. The table structure includes customer identifiers, campaign details (campaign_id, campaign_type), temporal information (dt for date), and key performance metrics such as sent messages, impressions, clicks, and same-day conversions. The campaign types cover a comprehensive range of UPI features including bank linking, mobile number mapping, RuPay credit card integration, UPI Lite activation, statement downloads, payment widgets, and analytics features. The data appears to be organized at a customer-campaign-date level granularity.

business_description: This table serves as the foundation for tracking and analyzing the effectiveness of UPI growth campaigns across Paytm's digital payments ecosystem. It enables business teams to monitor campaign performance metrics, measure user engagement through the funnel (from message sent to conversion), and evaluate the success of different UPI feature adoption drives. The table supports strategic decision-making for UPI product growth, campaign optimization, feature rollout effectiveness, and customer acquisition/activation initiatives. It's primarily used by marketing analytics teams, product managers, and growth teams to track UPI ecosystem expansion and user engagement with new payment features.",Daily,UPI,lite_dt,"The table is part of a comprehensive UPI feature tracking ecosystem and specifically focuses on UPI Lite activations. The naming convention suggests it's one of several tables tracking different UPI feature adoption metrics. The table appears to be actively used in growth campaign analytics and performance monitoring.; The table appears to be part of a larger UPI ecosystem within Paytm's data architecture. The SQL context shows it's used alongside other payment-related tables (bank_link, mapper, cc_all_linkages) suggesting a comprehensive tracking system for various UPI and payment service activations. The table name suggests it specifically tracks ""lite"" service activations, which aligns with UPI Lite being a simplified payment service for small transactions.; The table appears to be specifically designed for tracking UPI Lite activations as part of growth campaigns. The lite_dt field suggests this is the primary date dimension for partitioning and filtering data. The table is used in complex UNION queries with other UPI feature tables for comprehensive growth analysis.; The table name ""lite_active"" suggests it may have specific focus on UPI Lite campaigns or active campaign data. The SQL query shows extensive campaign type categorization logic, indicating this table supports complex campaign classification and reporting requirements. The presence of same-day conversion tracking suggests real-time or near-real-time campaign performance monitoring capabilities.","This table likely joins with customer master tables using customer_id, campaign management tables using campaign_id, and potentially transaction tables to measure actual UPI usage post-campaign exposure. It may be related to other campaign performance tables across different payment verticals and could be used in conjunction with user behavior tables to create comprehensive user journey analytics. The table serves as a bridge between marketing campaign data and payment transaction outcomes.; This table is part of a union query structure that combines activation data from multiple payment services including bank linking, RuPay credit card linking, and UPI statement downloads. It's commonly joined with campaign data (CLM - Campaign Lifecycle Management) tables to correlate marketing impressions and clicks with actual service activations. The table likely has relationships with customer master tables through customer_id and with campaign tracking tables through temporal joins on the lite_dt field. It serves as a conversion event source in marketing attribution analysis.; This table is commonly joined with other UPI feature tables in the user_paytm_payments schema, including bank_link, mapper, cc_all_linkages, upi_statement_download_V1, and widget_added_rec_money_ER_daily tables. It's typically used in UNION operations to create comprehensive feature adoption reports, where each table contributes different UPI feature metrics. The table joins are primarily based on customer_id and date ranges, and it's frequently used in time-series analysis alongside other UPI adoption tables to provide holistic campaign tracking insights.; This table is commonly joined with other UPI feature tables including bank_link, mapper, cc_all_linkages, upi_statement_download_V1, widget_added tables, spend_analytics, and lite_auto_topup. It's typically used in UNION operations to create comprehensive views of UPI feature adoption across multiple product lines. The customer_id field serves as the primary key for joining with user demographic and behavior tables. The table supports campaign analysis by correlating activation events with marketing touchpoints and banner interactions."
