table_name,table_description,refresh_frequency,vertical,partition_column,remarks,relationship_context
hive.user_paytm_payments.customer_vpa,"data_description: The customer_vpa table appears to be a core customer reference table containing Virtual Payment Address (VPA) information for UPI users. This table likely stores customer identifiers, VPA handles, and associated metadata that enables mapping customers to their UPI identities. The table structure would typically include customer IDs, VPA handles (like user@paytm), registration timestamps, and status information. It serves as a foundational table for linking customer activities across the UPI ecosystem.

business_description: This table is essential for UPI business operations, serving as the primary reference for customer VPA management and analytics. It supports UPI growth campaign tracking by enabling customer identification across various UPI features like bank linking, RuPay CC linking, UPI Lite activation, and statement downloads. The table is used in conjunction with other UPI feature tables to analyze customer adoption patterns, track feature usage, and measure campaign effectiveness. It enables businesses to understand customer engagement with different UPI functionalities and supports targeted marketing and product development decisions.",Daily,UPI,dt,"Core reference table for UPI operations. Column information not provided in the input, but based on usage context, it likely contains customer_id, vpa, creation_date, status, and partition columns. The table appears to be fundamental for UPI customer identification and is heavily used in growth campaign analytics.; Table schema information is not available in the provided columns list, but based on usage context it appears to be a core reference table. The table is heavily used in joins with other UPI feature tables for comprehensive customer journey analysis.","This table serves as a central reference table that is joined with multiple UPI feature tables including bank_link, mapper, cc_all_linkages, lite_active, upi_statement_download_V1, and widget_added_rec_money_ER_daily. It's typically joined on customer_id to map customer activities across different UPI features. The table enables cross-feature analysis and customer journey tracking in the UPI ecosystem, making it essential for comprehensive UPI analytics and growth measurement.; This table serves as a central reference point for multiple UPI-related tables including bank_link, mapper, cc_all_linkages, lite_active, upi_statement_download_V1, widget_added_rec_money_ER_daily, widget_added_snp_ER_daily, spend_analytics, and lite_auto_topup. It's typically joined on customer_id to identify UPI-enabled customers and track their feature adoption. The table acts as a master customer VPA registry that enables linking customer activities across different UPI services and features for comprehensive growth campaign tracking and analytics."
hive.user_paytm_payments.p2p_in,"data_description: The p2p_in table contains peer-to-peer incoming payment transaction data within the UPI ecosystem. This table likely stores records of money transfer transactions where funds are received by users through UPI payment methods. The table structure appears to include customer identification fields, transaction timestamps (dt column for partitioning), and potentially transaction amounts and other payment metadata. The data represents the receiving side of P2P transactions and is used for tracking user engagement and adoption metrics.

business_description: This table serves critical business functions for UPI growth tracking and campaign effectiveness measurement. It's used to analyze user adoption patterns of various UPI features, track day-over-day growth metrics, and measure the success of UPI growth campaigns. The table supports business operations by enabling teams to monitor P2P transaction volumes, identify user engagement trends, and assess the effectiveness of feature rollouts and marketing campaigns. It's particularly valuable for product teams tracking UPI feature adoption and growth teams measuring campaign performance.",Daily,UPI,dt,"The table appears to be part of a comprehensive UPI analytics ecosystem with multiple related tables. The SQL query shows it's being used in conjunction with various other UPI feature tables to create a holistic view of user adoption. The table columns information is empty, which limits detailed analysis of the schema structure.","This table is part of a larger UPI payments data ecosystem and is commonly used alongside other tables in the user_paytm_payments schema including bank_link (for bank linking activities), mapper (for user mapping), cc_all_linkages (for credit card linkages), lite_active (for UPI Lite activations), and upi_statement_download_V1 (for statement downloads). The table is typically joined with these related tables using customer_id as the common key and dt for time-based filtering. It serves as a foundational table for UPI transaction analysis and is frequently aggregated with other feature adoption tables to provide comprehensive UPI growth metrics and campaign tracking insights."
hive.user_paytm_payments.p2p_reminders,"data_description: The p2p_reminders table contains data related to peer-to-peer payment reminders within the UPI ecosystem. Based on the context, this table likely stores information about reminder notifications sent to users for pending or incomplete P2P transactions, including customer identifiers, reminder dates, and associated transaction details. The table structure supports tracking of reminder campaigns and their effectiveness in driving user engagement with P2P payment features.

business_description: This table supports UPI growth campaign tracking by providing insights into P2P payment reminder effectiveness. It is used in business contexts to monitor user engagement with payment reminders, analyze the success rate of reminder campaigns, and optimize notification strategies to increase P2P transaction completion rates. The table helps business teams understand user behavior patterns related to payment reminders and supports decision-making for UPI feature adoption campaigns.",Daily,UPI,dt,"The table column information is empty in the provided input, which limits the ability to provide detailed structural analysis. However, based on the SQL context and table naming convention, this appears to be a standard UPI analytics table with typical fields like customer_id and dt (date) for partitioning.","This table is part of a larger UPI analytics ecosystem within the user_paytm_payments schema. It relates to other UPI feature tables mentioned in the SQL context including bank_link, mapper, cc_all_linkages, lite_active, upi_statement_download_V1, and widget_added_rec_money_ER_daily. The table is commonly joined with other UPI feature tables using customer_id and date fields to create comprehensive UPI growth tracking reports. It supports union operations with other feature tables to provide holistic views of UPI feature adoption and user engagement across different payment functionalities."
a,"data_description: This table contains UPI marketing campaign tracking data with customer-level campaign interactions and performance metrics. It stores campaign identifiers, campaign types (covering various UPI features like bank linking, mapper services, RuPay credit card linking, UPI Lite, statement downloads, etc.), customer identifiers, and date information. The table supports funnel analysis tracking the complete user journey from campaign delivery through conversion, enabling measurement of push notification effectiveness across different UPI feature categories.

business_description: This table supports UPI growth marketing operations by enabling campaign performance analysis and feature adoption tracking. It is used to measure the effectiveness of push notification campaigns aimed at driving UPI feature adoption, including bank account linking, mobile number mapping, RuPay credit card integration, UPI Lite activation, and various widget usage promotions. Marketing teams use this data to optimize campaign targeting, measure conversion rates, and track same-day conversions across different UPI feature categories to drive user engagement and platform growth.",Daily,UPI,dt,"The table appears to be a derived/aggregated table created from campaign tracking events. The SQL query shows extensive campaign type categorization logic, suggesting this table is used for standardized campaign reporting across multiple UPI feature categories.","This table likely joins with customer dimension tables on customer_id for demographic analysis, campaign configuration tables on campaign_id for campaign details, and potentially with UPI transaction tables to measure post-campaign conversion behavior. It may also relate to notification delivery tables and user engagement tables to build complete funnel analysis from campaign delivery to actual UPI feature usage."
hive.team_measurement.push_campaigns_customer_v1,"data_description: This table contains push notification campaign performance data at the customer level for UPI growth initiatives. It stores campaign metrics including sent notifications, impressions, clicks, and same-day conversions across various UPI feature campaigns. The table includes campaign identifiers, customer IDs, campaign types, and categorizes campaigns into business-friendly feature types like Bank Linking, Mapper, RuPay CC Linking, UPI Lite Activation, Download UPI Statement, Receive Money widget, Scan & Pay widget, Spends Analytics, and other UPI-related features. It appears to be a versioned table (v1) designed to track campaign funnel metrics from notification delivery to conversion.

business_description: This table supports UPI growth marketing operations by enabling measurement and analysis of push notification campaign effectiveness. It's used to track conversion funnels for different UPI feature adoption campaigns, helping product and marketing teams understand which campaigns drive user engagement and feature activation. The table supports campaign performance dashboards, ROI analysis for different UPI features, and optimization of push notification strategies. It enables business teams to measure the effectiveness of growth initiatives across various UPI use cases including P2P transfers, merchant payments, bank account linking, and new feature adoption campaigns.",Daily,UPI,dt,"This is a versioned table (v1) suggesting it may have evolved schema versions. The table includes complex campaign type categorization logic that maps technical campaign types to business-friendly feature categories. The conversion tracking is specifically for same-day conversions, indicating focus on immediate campaign impact measurement.","This table likely joins with customer dimension tables using customer_id for demographic analysis, campaign management tables using campaign_id for campaign metadata, and potentially with UPI transaction tables to validate actual feature usage post-conversion. It may also relate to notification delivery tables for detailed funnel analysis and could be aggregated with other campaign performance tables for comprehensive marketing analytics across different channels and verticals."
