table_name,table_description,refresh_frequency,vertical,partition_column,remarks,relationship_context
hive.team_measurement.banner_campaigns_customer_v1,"data_description: This table contains customer-level banner campaign interaction data with detailed metrics on impressions, clicks, unique impressions, unique clicks, and conversion events. The table structure includes campaign identification fields (banner_id, measurement_label, feature_group), placement context (storefront_name, view_type, view_name, priority), and aggregated performance metrics. It captures both exposure metrics (impressions/clicks) and outcome metrics (conversions) at a granular level, allowing for comprehensive campaign performance analysis. The data appears to be aggregated at the customer and campaign level with daily partitioning.

business_description: This table serves as the primary data source for measuring and optimizing UPI growth marketing campaigns. It supports campaign performance analysis by tracking how different banner placements across various storefronts and views drive user engagement and conversions to UPI features like bank linking, card linking, UPI Lite activation, and statement downloads. Business teams use this data to evaluate campaign ROI, optimize banner placement strategies, measure feature adoption rates, and make data-driven decisions about marketing spend allocation. The table enables detailed funnel analysis from impression to conversion, supporting growth marketing initiatives aimed at expanding UPI user base and feature utilization.",Daily,UPI,dt,"Table appears to be a versioned view (v1) suggesting it may be subject to schema evolution. The connection to multiple UPI feature tables in the query context indicates this is likely a derived/aggregated table rather than a raw event table. Column information is not provided, but based on the SQL context, it likely contains standard campaign tracking dimensions and metrics.; The table is version 1 (v1) indicating it may be subject to schema evolution. The SQL context shows complex conversion logic with multiple UPI features being tracked, suggesting this is a sophisticated campaign measurement system. The date range logic in queries indicates this table supports both historical analysis and near real-time campaign monitoring.","This table likely joins with campaign configuration tables using banner_id, customer dimension tables using customer_id, and various UPI feature adoption tables (bank_link, cc_all_linkages, lite_active, UPI_FeatureAdoption_Olap_Daily_v3) for conversion attribution. It serves as a bridge between campaign exposure data and business outcome metrics, enabling end-to-end campaign performance measurement. The table is commonly used in conjunction with customer segmentation tables and UPI transaction tables to provide comprehensive growth analytics and support campaign optimization workflows.; This table serves as a central hub for banner campaign analysis, connecting to multiple UPI feature tables including bank_link, mapper, cc_all_linkages, lite_active, upi_statement_download_V1, widget tables, spend_analytics, and lite_auto_topup. It's likely joined with these tables to track conversion from banner exposure to actual feature adoption. The table probably relates to customer master tables for demographic analysis and campaign targeting tables for attribution. It may also connect to broader marketing measurement frameworks and A/B testing platforms for comprehensive campaign evaluation."
hive.enterprise.upi_featureadoption_olap_daily_v3,"data_description: This table contains daily aggregated data for UPI feature adoption tracking and campaign performance measurement. It stores metrics related to various UPI features including bank linking, RuPay credit card linking, UPI Lite activation, UPI statement downloads, and receive money widget usage. The table includes campaign-related dimensions such as measurement labels, feature groups, banner IDs, storefront names, view types, and priorities, along with corresponding metrics like impressions, clicks, unique impressions, unique clicks, and conversion data. The data structure supports OLAP operations for analytical reporting and is partitioned by date for efficient querying.

business_description: This table serves as the foundation for UPI growth campaign tracking and feature adoption analysis. It enables business teams to measure the effectiveness of marketing campaigns promoting various UPI features, track user engagement through impression and click metrics, and analyze conversion rates for different UPI functionalities. The table supports campaign lifecycle management (CLM) by providing comprehensive visibility into how different campaign elements (banners, storefronts, views) perform in driving UPI feature adoption. Business stakeholders use this data to optimize marketing spend, improve campaign targeting, measure feature adoption success, and make data-driven decisions about UPI product development and marketing strategies.",Daily,UPI,dt,"This is version 3 of the UPI feature adoption OLAP table, suggesting it has undergone iterations for improvement. The table includes sophisticated campaign type categorization logic that maps various UPI campaign types to standardized feature groups, enabling consistent reporting across different UPI services.; This is version 3 of the UPI feature adoption OLAP table, suggesting iterative improvements in schema design. The table appears to be optimized for analytical queries and dashboard consumption rather than transactional operations. The SQL context shows complex feature tracking across multiple source tables, indicating sophisticated data aggregation processes.; This is version 3 of the UPI feature adoption OLAP table, suggesting it has evolved over time with enhanced capabilities. The table supports complex campaign attribution and feature adoption tracking with multiple dimensions for granular analysis. The SQL query shows integration with multiple source tables for comprehensive UPI feature tracking.","This table appears to be a central aggregation table that joins with multiple UPI-related source tables including hive.user_paytm_payments.bank_link, hive.user_paytm_payments.mapper, hive.user_paytm_payments.cc_all_linkages, and hive.user_paytm_payments.lite_active. It likely serves as a fact table in a star schema design, connecting to dimension tables for campaign attributes, customer data, and feature metadata. The table is commonly used in conjunction with campaign management systems and business intelligence tools for UPI growth analytics and performance reporting.; This table likely joins with customer dimension tables using customer_id, campaign management tables using campaign_id, and other UPI transaction or user behavior tables. It serves as a central fact table for UPI campaign analytics and would typically be used alongside UPI transaction tables, user profile tables, and campaign configuration tables to provide comprehensive insights into UPI feature adoption and marketing campaign effectiveness.; This table aggregates data from multiple upstream tables including hive.user_paytm_payments.bank_link, hive.user_paytm_payments.mapper, hive.user_paytm_payments.cc_all_linkages, hive.user_paytm_payments.lite_active, hive.user_paytm_payments.upi_statement_download_V1, and widget-related tables. It serves as a consolidated view for UPI feature adoption metrics and is likely joined with user dimension tables for customer segmentation analysis. The table is primarily used in dashboard queries with date-based filtering and aggregations, making it a key component in the UPI analytics data pipeline."
hive.user_paytm_payments.check_balance,"data_description: The check_balance table contains UPI campaign tracking data focused on balance-related features and user engagement metrics. The table stores campaign performance data including customer interactions, campaign types, and conversion tracking over time. It includes fields for customer identification, campaign categorization (spanning various UPI features like Bank Linking, Mapper services, RuPay CC operations, UPI Lite, and balance-related functionalities), and temporal data for tracking campaign effectiveness. The table structure supports funnel analysis with metrics for campaign reach, impressions, clicks, and same-day conversions.

business_description: This table serves as a core component of UPI growth campaign analytics, specifically tracking balance-checking and related UPI feature adoption campaigns. It enables marketing teams to monitor campaign effectiveness across different UPI functionalities, measure user engagement at various funnel stages (sent notifications to actual conversions), and optimize campaign strategies for different UPI features. The table supports business decisions around feature promotion, user activation strategies, and campaign ROI analysis for UPI growth initiatives, particularly focusing on balance-related services and broader UPI ecosystem adoption.",Daily,UPI,dt,"The table_columns field is empty, which limits the ability to provide detailed structural analysis. The table appears to be part of a larger UPI feature tracking ecosystem based on the query context that includes multiple UPI-related tables.; The table columns information is empty in the provided input, but based on the SQL context, it likely contains customer_id and dt fields at minimum. The table is part of a larger ecosystem of UPI feature tracking tables used for comprehensive campaign analysis.; The table_columns field is empty, which limits the ability to provide detailed column-level analysis. The table appears to be part of a larger data ecosystem for UPI campaign tracking and is used in complex union queries with other UPI-related tables for comprehensive conversion analysis.; The table name ""check_balance"" seems specific to balance-checking functionality, but the SQL context suggests it contains broader UPI campaign data across multiple feature types. The empty table_columns field limits detailed structural analysis. The SQL query shows extensive campaign type categorization logic, indicating this table supports comprehensive UPI feature campaign tracking beyond just balance checking.","This table likely joins with other UPI campaign tables on campaign_id and customer_id fields. It probably relates to user behavior tables for conversion tracking, campaign configuration tables for campaign details, and customer profile tables for segmentation analysis. The dt (date) field enables time-series joins with other daily aggregated UPI metrics tables. It may also connect to UPI transaction tables to validate actual conversion behaviors and feature adoption rates post-campaign exposure.; This table is closely integrated with other UPI-related tables in the user_paytm_payments schema, including bank_link, mapper, cc_all_linkages, and lite_active tables. It's commonly used in union operations to create comprehensive views of UPI user engagement activities. The table likely joins with campaign and customer tables using customer_id as a common key, and is frequently used alongside CLM (Campaign Lifecycle Management) data to track conversion funnels from impressions to actual UPI feature usage.; This table is one of multiple tables in the user_paytm_payments schema used together for UPI feature adoption tracking. It is commonly joined or unioned with other feature tables like bank_link, mapper, cc_all_linkages, lite_active, upi_statement_download_V1, and widget_added_rec_money_ER_daily. The relationships are typically based on customer_id and date fields, enabling comprehensive analysis of user behavior across different UPI features within the same time periods.; This table is part of a comprehensive UPI tracking system that includes relationships with multiple other tables such as bank_link, mapper, cc_all_linkages, lite_active, upi_statement_download_V1, widget_added_rec_money_ER_daily, widget_added_snp_ER_daily, spend_analytics, and lite_auto_topup. The table likely joins with these tables on customer_id and dt fields for holistic UPI feature adoption analysis. It serves as one component in tracking various UPI features and is commonly used in UNION operations to aggregate different types of UPI user activities for campaign effectiveness measurement."
hive.user_paytm_payments.self_transfer,"data_description: The self_transfer table contains transactional and campaign interaction data related to UPI self-transfer operations. It stores customer interactions with UPI self-transfer campaigns including campaign metadata (campaign_id, campaign_type), user identifiers (customer_id), temporal information (dt for date partitioning), and campaign performance metrics. The table appears to track the complete funnel from campaign delivery through conversion, supporting various UPI feature campaigns like bank linking, mapper services, RuPay CC linking, UPI Lite activation, and other UPI-related features.

business_description: This table serves as a critical component for UPI growth campaign analysis and optimization. It enables business teams to track the effectiveness of different UPI self-transfer promotion campaigns, measure conversion rates, and analyze user engagement patterns. The data supports campaign performance reporting, ROI analysis for UPI feature adoption campaigns, and strategic decision-making for UPI product growth initiatives. It's used to generate insights on which campaign types drive the most user engagement and successful self-transfer transactions, helping optimize marketing spend and campaign targeting for UPI services.",Daily,UPI,dt,"The table appears to be part of a comprehensive UPI analytics ecosystem. While column details are not provided, the usage pattern in the SQL query suggests it follows standard UPI table structure with customer_id and dt fields. The table is specifically focused on self-transfer transactions, which is a subset of overall UPI transactions.; The table appears to be part of a comprehensive UPI campaign tracking system with detailed campaign type categorization. The SQL context shows sophisticated campaign type mapping suggesting this is a mature analytics table used for business intelligence and campaign optimization.; The table columns information is empty in the input, but based on the SQL context, it likely contains fields like customer_id, dt (date), and other transaction-related attributes. The table is part of a complex analytical query that unions multiple UPI-related datasets for comprehensive campaign tracking.","This table likely joins with other UPI campaign tables based on campaign_id and customer_id. It may relate to broader UPI transaction tables for conversion analysis, customer dimension tables for segmentation, and campaign master tables for campaign details. Common joins would be with UPI transaction tables to validate actual self-transfer completions, user profile tables for demographic analysis, and campaign configuration tables for detailed campaign metadata.; This table is closely related to other UPI ecosystem tables including hive.user_paytm_payments.bank_link, hive.user_paytm_payments.mapper, hive.user_paytm_payments.cc_all_linkages, and hive.user_paytm_payments.lite_active. It's commonly joined or unioned with these tables in campaign conversion analysis queries. The table shares common attributes like customer_id and dt (date) with other tables in the user_paytm_payments schema, enabling comprehensive user journey tracking across different UPI features. It's also used alongside featurehub.enterprise.UPI_FeatureAdoption_Olap_Daily_v3 for feature adoption analysis.; This table is part of the broader hive.user_paytm_payments schema ecosystem and is commonly used alongside other UPI feature tables including bank_link (bank linking events), mapper (UPI ID mapping), cc_all_linkages (credit card linkages), lite_active (UPI Lite activations), upi_statement_download_V1 (statement downloads), and widget_added_rec_money_ER_daily (widget additions). It's typically joined with these tables using customer_id and dt fields for comprehensive UPI feature adoption analysis and growth campaign tracking. The table serves as one component in measuring overall UPI ecosystem health and user engagement."
clm,"data_description: The CLM table contains campaign lifecycle management data tracking digital marketing campaign performance and user conversion metrics. It stores impression and click data along with conversion events across various UPI and payment-related features. The table includes campaign attributes like banner_id, storefront_name, view_type, view_name, priority, measurement_label, and feature_group, along with aggregated metrics for impressions, clicks, unique impressions, unique clicks, impressions_conversion, and clicks_conversion. The data structure supports tracking campaign effectiveness across different touchpoints and user journey stages.

business_description: This table supports UPI growth campaign tracking and marketing analytics for digital payment services. It enables measurement of campaign ROI by tracking user interactions from initial impressions through to conversions across multiple UPI features including bank linking, RuPay credit card linking, UPI Lite activation, statement downloads, and receive money widgets. Business teams use this data to optimize campaign performance, measure feature adoption rates, track user engagement across different storefronts and view types, and make data-driven decisions about campaign prioritization and budget allocation for UPI growth initiatives.",Daily,UPI,dt,"The table appears to be an aggregated view combining campaign impression/click data with conversion events from multiple UPI feature tables. The SQL shows complex union operations tracking different conversion types, suggesting this is likely a derived table or view rather than a raw event table.","This table has relationships with multiple UPI feature tables including hive.user_paytm_payments.bank_link, hive.user_paytm_payments.mapper, hive.user_paytm_payments.cc_all_linkages, hive.user_paytm_payments.lite_active, and featurehub.enterprise.UPI_FeatureAdoption_Olap_Daily_v3. It serves as a central aggregation point for campaign performance data, joining campaign impression/click metrics with conversion events through customer_id matches. The table is commonly used in marketing analytics dashboards and is likely joined with customer dimension tables and other campaign metadata tables for comprehensive campaign analysis."
hive.user_paytm_payments.lite_auto_topup,"data_description: This table contains data related to UPI Lite auto top-up functionality, likely storing information about automatic wallet top-up transactions, configurations, or events. Based on the naming convention and context within the UPI ecosystem, it probably includes customer identifiers, transaction amounts, top-up triggers, timestamps, and status information for automated wallet funding operations. The table structure would typically include fields for tracking when auto top-ups are configured, executed, or modified by users.

business_description: This table supports UPI Lite wallet management operations by tracking automatic top-up behaviors and configurations. It enables business analysts to monitor user engagement with convenience features like auto top-up, measure adoption rates of wallet automation features, and understand user preferences for maintaining wallet balances. The data supports growth campaign tracking by providing insights into feature utilization patterns, helping optimize user experience for seamless payment flows, and identifying opportunities to promote wallet-based payment adoption among UPI users.",Daily,UPI,dt,"The table appears to have limited column information provided, but the SQL context suggests it contains customer_id and lite_dt fields. It's being used as part of a larger conversion tracking framework that combines multiple UPI-related activities including bank linking, credit card linking, and UPI statement downloads.; This table is part of a comprehensive UPI feature tracking ecosystem that includes multiple payment-related features. The table appears to be used specifically for measuring user adoption of convenience features that enhance the UPI payment experience. No column details were provided, but based on usage patterns, it likely follows similar schema conventions as other tables in the user_paytm_payments schema.; The table appears to be part of a comprehensive UPI feature tracking ecosystem. Column information is not provided, but the table name suggests it's specifically focused on UPI Lite auto top-up functionality, which is a key convenience feature for wallet management.; Table columns information is empty in the provided input, making it difficult to provide detailed column-level analysis. The table appears to be specifically focused on UPI Lite Auto Top-up functionality within the broader UPI ecosystem.","This table is commonly joined with other UPI-related tables in union queries for comprehensive conversion tracking. It relates to bank_link (bank linking activities), cc_all_linkages (credit card linkages), lite_active (UPI Lite activations), and mapper tables. The table is typically used in campaign measurement contexts where UPI Lite activation events serve as conversion metrics alongside other UPI engagement activities. It's part of a broader ecosystem of tables that track the complete UPI user journey from initial engagement to feature adoption.; This table is likely joined with campaign tracking tables using campaign_id and customer_id fields. It appears to be part of a larger UPI analytics ecosystem where it connects with user profile tables, transaction tables, and campaign performance tables. The table is commonly used in conjunction with other UPI tables to create comprehensive campaign performance dashboards and is frequently aggregated by date (dt) and campaign dimensions for reporting purposes.; This table is part of the broader UPI payments ecosystem and likely joins with other tables in the hive.user_paytm_payments schema through customer_id fields. It relates to lite_active table for UPI Lite activations, bank_link for funding source connections, and mapper for customer mapping. The table is commonly used in UNION operations with other UPI feature tables to create comprehensive feature adoption reports, particularly for growth campaign analysis and user engagement tracking across various UPI functionalities.; This table is commonly joined with other UPI feature tables in the user_paytm_payments schema including bank_link, cc_all_linkages, lite_active, upi_statement_download_V1, widget tables, and spend_analytics. It's typically used in UNION operations to create comprehensive feature adoption reports across different UPI functionalities. The table relationships are primarily based on customer_id and date (dt) columns for tracking user journey across multiple UPI features. It's frequently used alongside campaign tracking data to measure the impact of growth initiatives on feature adoption."
