term,type,definition,business_alias
Agent Tickets,Metric,"Total number of tickets escalated to human agents for assistance, representing cases that required human intervention beyond automated support. This includes all tickets or cases that required human agent intervention or handover from automated systems. Measured as total count of tickets or cases that required human agent intervention or handover.","Agent Handover, AH Tickets, Agent Handover Tickets"
agent_ticket_count_phone,Metric,Total count of tickets handled by agents through phone/voice channels,Phone Agent Tickets
SUM(agent_ticket_count_phone),Metric / Calculated Field,Total aggregated count of all phone-based agent tickets across selected time period and dimensions,Total Phone Agent Tickets
Merchant Count,Metric,Count of merchants who have interacted with or used IVR services,
SUM(ivr_merchant_count),Metric / Calculated Field,"Total aggregated count of merchants using IVR services, summed across weekly intervals",
Unique Merchant Count - IVR,Metric / Calculated Field,"Total sum of merchants who interacted through the Interactive Voice Response (IVR) system, aggregated weekly",
IVR Merchant Count,Metric,Count of individual merchants using the Interactive Voice Response system for care services,
AVG Latency,Metric / Calculated Field,"Average of all latency measurements calculated using AVG(all_avg_latency), representing the mean response time in seconds",
Latency,Metric,"Time delay between a request being sent and the response being received, typically measured in milliseconds or seconds.","Response Time, Response Time, Request Delay"
Monthly,Category,Time aggregation level grouping metrics by calendar month for trend analysis and reporting purposes.,"Month-over-Month, Monthly Aggregation"
Year+Month,Metric / Calculated Field,"Combined temporal identifier calculated as Year multiplied by 100 plus Month number, used for chronological sorting.",
Median Latency,Metric,"Average of median latency values measured in the healthcare system, representing the middle value of response times or delays aggregated by month",
Monthly Median Latency,Metric / Calculated Field,"Average of median latency values calculated for each month, showing the monthly trend of typical response times.",
P95 Latency,Metric / Calculated Field,"The 95th percentile latency measurement, representing the response time below which 95% of requests are completed, calculated as the average of p95_latency values over the time period",P95
P99,Metric / Calculated Field,"Average of the 99th percentile latency values, calculated as AVG(p99_latency). Represents the average response time where 99% of requests are faster than this value.","P99 Latency, 99th Percentile Latency"
P99 Latency,Metric,"The 99th percentile of response times, indicating that 99% of requests complete faster than this threshold value.",
P95,Metric / Calculated Field,"95th percentile latency averaged over time periods, calculated as AVG(p95_latency)",
P90,Metric / Calculated Field,"Average of p90_latency values, representing the 90th percentile latency where 90% of requests complete faster than this measured time.","90th Percentile Latency, 90th Percentile"
P90 Latency,Metric,"Performance metric measuring the 90th percentile response time, indicating that 90% of system requests complete within this latency threshold.","90th Percentile Response Time, 90th Percentile Latency"
Sessions,Metric,"Count of distinct support tickets in the system, representing unique support interactions or cases",
CST,Category,Customer Support Team - support tickets and interactions related to customer users (role_type = 1),Customer Support Team
Tickets,Metric,Distinct count of support ticket IDs representing unique support cases or interactions,
Question Language Code,Dimension,"The language selected or used for support questions, mapped from language codes (en, hi, te, etc.) to readable language names (English, Hindi, Telugu, etc.)",
Role Type,Dimension,User classification where role_type = 1 indicates Customer users and role_type = 2 indicates Merchant users,
Support Language,Category,"Available languages for support including English, Hindi, Telugu, Marathi, Tamil, Kannada, Gujarati, Bengali, Malayalam, Punjabi, and Others",
Language Select,Category,"Language selection data showing the question language codes chosen during support ticket conversations, mapped to language names like English, Hindi, Telugu, etc.",
TAT(In Days),Metric / Calculated Field,Overall Turnaround Time calculated as total TAT days divided by total tickets with TAT data,"TAT, Turnaround Time"
MHD (TAT),Metric / Calculated Field,MHD agent Turnaround Time calculated as sum of MHD TAT days divided by MHD tickets with TAT data,MHD Turnaround Time
Service (TAT),Metric / Calculated Field,Service provider Turnaround Time calculated as sum of service TAT days divided by service tickets with TAT data,Service Turnaround Time
Overall MSAT%,Metric / Calculated Field,"Overall customer satisfaction percentage calculated as total satisfied tickets divided by total tickets with feedback, multiplied by 100","MSAT, Customer Satisfaction Percentage"
Agent MSAT,Metric / Calculated Field,"MHD agent customer satisfaction percentage calculated as agent satisfied tickets divided by agent tickets with feedback, multiplied by 100",Agent Customer Satisfaction
Service MSAT,Metric / Calculated Field,"Service provider customer satisfaction percentage calculated as service satisfied tickets divided by service tickets with feedback, multiplied by 100",Service Customer Satisfaction
issue_l1,Dimension,Primary level issue category classification for customer service tickets,Issue Level 1
issue_l2,Dimension,Secondary level issue category classification providing more detailed issue categorization,Issue Level 2
Feedback Received %,Metric / Calculated Field,"Percentage of service tickets that received customer feedback, calculated as total feedback given divided by total tickets multiplied by 100","Response Rate %, Feedback Rate %"
MSAT %,Metric / Calculated Field,"Customer satisfaction percentage calculated from feedback responses. Represents the rate of satisfied customers by dividing positive/happy feedback responses by total feedback responses and multiplying by 100. Specifically calculated as Happy responses divided by (Happy + Sad responses), multiplied by 100. Used across dashboards to measure satisfaction rates among service respondents.","Mobile Satisfaction %, Customer Satisfaction %, Member Satisfaction Rate, Member Satisfaction %, Mental Health Satisfaction %, Bot satisfaction rate, Monthly Satisfaction %, Customer Satisfaction Percentage, Mean Satisfaction, Customer Satisfaction Rate, Customer Satisfaction Score, Customer Satisfaction, MSAT"
Feedback Given,Metric,Total count of sessions where users provided feedback or satisfaction ratings,
Care Dashboard Metrics,Category,"Collection of customer service and support metrics including sessions, agent handovers, and service tickets",MHD Metrics
Intent wise Tickets Creation %,Category,"Percentage breakdown of ticket creation across different service intent categories, showing the distribution of customer service requests by business area",
Profile,Metric / Calculated Field,"Percentage of profile-related tickets escalated to first-line defense, calculated as (profile FD tickets / total profile tickets) * 100",
Wealth,Metric / Calculated Field,"Percentage of wealth management tickets escalated to first-line defense, calculated as (wealth FD tickets / total wealth tickets) * 100",
SB Service Tickets,Metric / Calculated Field,"Percentage of Soundbox service tickets escalated to first-line defense, calculated as (soundbox FD tickets / total soundbox tickets) * 100",Soundbox Service Tickets
SB Agent Handover,Metric / Calculated Field,"Percentage of Soundbox tickets that required handover from AI bot to human agent, calculated as AI bot forwarded tickets divided by total Soundbox tickets",Soundbox Agent Handover
FD Tickets,Metric,"First deflection tickets or forwarded tickets that require escalation or additional handling beyond initial automated response. These are tickets escalated to human agents, often referred to as Front Desk tickets. The term encompasses tickets that cannot be resolved through initial automated systems and need human intervention or further escalation. Represents the number of tickets escalated to human agents across different dashboard contexts.","First Defense Tickets, First Desk Tickets, First Deflection Tickets, Forwarded Tickets, FD, Front Desk, Front Desk Tickets"
FetchMerchantDetails,Metric,Total count of sessions where merchant details were fetched or retrieved from the system.,
AgentHandover,Metric,Total number of attempts where customer interactions were transferred or handed over to human agents.,
RaiseServiceRequest,Metric,Total number of attempts to raise or create service requests in the system.,
SettlementAndPaymentInfo,Metric,Total number of attempts to retrieve settlement and payment information for merchants.,
CheckSoundboxHardware,Metric,Total number of attempts to check or validate Soundbox hardware status.,
TestBroadcast,Metric,Total number of attempts to perform test broadcasts on the system.,
Function Call Metrics,Category,"Collection of metrics tracking various customer service function calls including merchant details retrieval, agent handovers, service requests, payment info, hardware checks, and test broadcasts.",
Function Calls,Category,"Collection of various customer service function calls including merchant details fetching, agent handovers, service requests, payment information retrieval, hardware checks, and test broadcasts.",
Total Tickets,Metric,Complete count of customer service tickets created for each intent category,
AI Bot,Category,Automated customer service system that handles initial ticket processing before potential handover to human agents,AIBot
# Language Change,Metric,Total count of language transitions aggregated by summing individual transition counts from the language transition data.,Language Change
Language Change,Synonym,# Language Change,
Language Transition,Category,"The specific type or category of language change being tracked, used as a grouping dimension for analyzing transition patterns.",
Transition Count,Metric,Individual count of language transition events that are aggregated to calculate total language changes.,
Bot MSAT %,Metric / Calculated Field,"Customer satisfaction percentage for bot interactions, calculated as (Total bot happy responses * 100) divided by Total bot feedback given, representing the percentage of positive feedback for bot customer service interactions","Bot Satisfaction Percentage, also referred as Bot MSAT, Bot MSAT Percentage, Bot Satisfaction Rate, Bot Satisfaction Percentage, Bot Merchant Satisfaction Percentage"
bot_happy,Metric,Total count of positive/satisfied feedback responses received from bot interactions,"Bot Positive Feedback, Positive Bot Feedback"
bot_feedback_given,Metric,Total count of sessions where users provided feedback to the bot,"Total Bot Feedback, Bot Total Feedback"
Bot Feedback Given,Metric,Total count of bot sessions where users provided feedback,
Bot Happy,Metric,Total count of positive/satisfied feedback responses from bot users,
Bot Satisfaction Metrics,Category,Collection of metrics measuring user satisfaction and engagement with bot services including feedback rates and satisfaction percentages,
fd_tickets,Metric,Total count of tickets processed by the system,Freshdesk tickets
agent_feedback_given,Metric,"Total count of feedback instances provided by agents, used as denominator for satisfaction calculations",
agent_happy,Metric,Count of positive or satisfied feedback responses from agents indicating happy customer interactions.,Positive Agent Feedback
active_sessions,Metric,Total count of active user sessions with the bot system,
Intent wise Ticket,Category,Customer service tickets categorized by customer intent or purpose of the interaction,Ticket by Intent
Intent wise Ticket Only,Category,Category of customer satisfaction metrics focused specifically on ticket-based interactions analyzed by customer intent.,
Service Feedback,Metric,Total count of feedback responses provided by customers on service tickets.,"Customer Feedback, Service Responses"
Service Happy,Metric,Total count of positive or satisfied feedback responses from customers regarding service quality.,"Positive Feedback, Satisfied Responses"
Service Feedback Given,Metric,Total count of customer feedback responses received for service tickets,
Service Ticket Metrics,Category,Collection of metrics related to customer service performance including feedback rates and satisfaction scores,
CTA Displayed #,Metric,Total count of unique users who were shown a Call-to-Action (CTA) during the specified time period.,"CTA Shown, Users Shown"
CTA Clicked #,Metric,Total count of unique users who clicked on a Call-to-Action (CTA) during the specified time period.,"CTA Engaged, Users Clicked"
CTR %,Metric / Calculated Field,"Click-through rate calculated as (CTA Clicked # × 100) ÷ CTA Displayed #, representing the percentage of users who clicked after being shown a CTA.","Click-Through Rate, Bot CTR, Click-through rate"
CTA,Category,"Call-to-Action elements displayed to users, representing interactive prompts designed to encourage specific user actions.",Call-to-Action
Bot CTR,Category,"Bot Click-Through Rate metrics measuring user engagement with automated chat interface elements including CTA displays, clicks, and conversion rates",Chatbot Performance Metrics
Week of the year,Metric,"The week number within a calendar year, used as a time dimension for tracking weekly performance trends",
IVR Contact Ratio (%),Metric / Calculated Field,"Percentage of total IVR calls relative to the contact ratio base count, calculated as (Total IVR Calls * 100) / Contact Ratio Base Count",
Bot Contact Ratio(%),Metric / Calculated Field,"Percentage of bot tickets relative to the contact ratio base count, calculated as (Total Bot Tickets * 100) / Contact Ratio Base Count",
Bot MSAT(%),Metric / Calculated Field,"Bot satisfaction percentage based on positive responses, calculated as (Bot Positive Responses / Total Bot Responses) * 100","Bot Satisfaction Score, MSAT also referred as Customer Satisfaction, Bot Satisfaction Rate"
Bot to MHD Passthrough(%),Metric / Calculated Field,"Percentage of bot interactions that were escalated to MHD agents, calculated as (Agent Ticket Count Bot * 100) / Bot Active Ticket Count","Bot to MHD Escalation Rate, Bot MHD Escalation Rate"
Feedback % - MHD Agent,Metric / Calculated Field,"Percentage of MHD agent interactions that received customer feedback, calculated as (Agent Tickets Feedback Received * 100) / Agent Tickets For Response",MHD Agent Feedback Rate
Agent Ticket Count - Bot (MHD & Service),Metric / Calculated Field,"Total number of tickets escalated from bot to both MHD agents and service department, calculated as Agent Ticket Count Bot + Bot to Service Ticket Count","Total Agent Escalations, Total Bot Escalations"
Agent Ticket Count - Bot MHD,Metric,Total number of tickets escalated from bot interactions specifically to MHD agents,"Bot MHD Escalations, Bot to MHD Tickets, MHD Escalations"
Agent Ticket Count- Bot Service,Metric,Total number of tickets escalated from bot interactions specifically to Service team agents,"Service Escalations, Bot Service Escalations, Bot to Service Tickets"
MSAT(%) MHD Agent,Metric / Calculated Field,"MHD Agent satisfaction percentage based on positive feedback, calculated as (Agent Tickets MSAT Received / Agent Tickets Feedback Received) * 100","MSAT also referred as Customer Satisfaction, MHD Agent Satisfaction Rate, MHD Agent Satisfaction Score"
Passthrough,Category,"Process of escalating or transferring tickets from one service channel to another (e.g., from Bot to Agent)","Escalation, Transfer, Escalation Rate"
Feedback Percentage,Category,Metrics tracking the percentage of service interactions that received customer feedback responses,Response Rate
Month of the year,Dimension,Time dimension representing the calendar month when customer service activities occurred,"Monthly Period, Month"
Passthrough Rate,Category,"Metrics measuring the percentage of interactions escalated from one service channel to another (Bot to MHD, Bot to Service)",Escalation Rate
AVG Eval Score %,Metric / Calculated Field,Average evaluation score converted to percentage. Calculated as the average of avg_eval_score multiplied by 100.,
Bot Containment %,Metric / Calculated Field,"Percentage of customer sessions handled by bot without escalation to human agents. Calculated as (Total Active Sessions - FD Tickets) divided by Total Active Sessions, multiplied by 100.",
Bad Eval Share %,Metric / Calculated Field,"Percentage of evaluations marked as bad quality. Calculated as Bad Evaluation Scores divided by (Good + Bad Evaluation Scores), multiplied by 100.",Bad Evaluation Rate
Sad,Metric,Count of negative customer feedback responses indicating dissatisfaction.,"Negative Feedback, Negative Responses"
Eval Score Good,Metric,Number of evaluations classified as good quality.,Good Evaluations
Eval Score Bad,Metric,Number of evaluations classified as bad quality.,Bad Evaluations
Quality Metrics,Category,"Collection of performance indicators measuring service quality including evaluation scores, bot containment, customer satisfaction, and evaluation quality distribution.",Service Quality KPIs
Analyzed %,Metric / Calculated Field,"Percentage of active sessions that progressed to analysis phase, calculated as (Analyzed Sessions / Active Sessions) * 100",Analyzed Percentage
Eval Completed %,Metric / Calculated Field,"Percentage of active sessions where evaluation was completed, calculated as (Total Evaluations Completed / Total Active Sessions) * 100",Evaluation Completion Rate
Analyzed Sessions,Metric,Total count of sessions that have been processed through the analysis phase of the MHD evaluation system.,
Eval Completed,Metric,Total count of sessions that have successfully completed the entire wealth evaluation process,
CST Entity,Dimension,"Entity type dimension for filtering data, includes p4bsoundbox and p4bAIBot",
positive_user_sentiment,Metric,Count of users expressing positive sentiment towards the evaluated system or service,
negative_user_sentiment,Metric,Count of users expressing negative sentiment towards the evaluated system or service,
neutral_user_sentiment,Metric,Count of users expressing neutral sentiment towards the evaluated system or service,
Positive Change %,Metric / Calculated Field,"Percentage of positive user sentiment out of total user sentiment, calculated as sum of positive user sentiment divided by total sentiment (positive + negative + neutral) multiplied by 100",
Negative Change %,Metric / Calculated Field,"Percentage of negative user sentiment out of total user sentiment, calculated as sum of negative user sentiment divided by total sentiment (positive + negative + neutral) multiplied by 100",
Neutral Change %,Metric / Calculated Field,"Percentage of neutral user sentiment out of total user sentiment, calculated as sum of neutral user sentiment divided by total sentiment (positive + negative + neutral) multiplied by 100",
User Sentiment Analysis,Category,"Collection of metrics measuring and analyzing user sentiment distribution including positive, negative, and neutral sentiment percentages",Final User Sentiment Analysis
Final User Sentiment,Category,"Collection of metrics measuring different types of user sentiment changes including neutral, positive, and negative changes.",
Neutral Change #,Metric,"Sum of neutral user sentiment changes aggregated by day, representing users whose sentiment remained unchanged or neutral.",Neutral Change Count
Positive Change #,Metric,"Sum of positive user sentiment changes aggregated by day, representing users whose sentiment improved or became more favorable.",Positive Change Count
Negative Change #,Metric,"Sum of negative user sentiment changes aggregated by day, representing users whose sentiment declined or became less favorable.",Negative Change Count
User Sentiment,Category,"Collection of metrics measuring changes in user attitudes and feelings, including Positive Change #, Negative Change #, and Neutral Change #.",
MHD Eval,Category,"Evaluation dashboard category containing quality assessment metrics for service interactions, including empathy, resolution, and response relevance scores","Mobile Handheld Device Evaluation, Mental Health Dashboard Evaluation"
Bot Repetition %,Metric / Calculated Field,"Percentage of completed evaluations where the bot provided repetitive responses, calculated as (agent_response_repetition count / total eval_completed) * 100",Bot Response Repetition Rate
Bot Failed %,Metric / Calculated Field,"Percentage of completed evaluations where the bot failed to execute function calls properly, calculated as (function_call_failed / eval_completed) * 100",Bot Function Failure Rate
Intent Detection Failed %,Metric / Calculated Field,"Percentage of completed evaluations where the bot failed to correctly detect user intent, calculated as (intent_incoherence_count / total eval_completed) * 100",Intent Detection Failure Rate
eval_completed,Metric,Total number of bot evaluations that were successfully completed and can be used for performance analysis,
agent_response_repetition,Metric,Count of instances where the bot agent provided repetitive or redundant responses during evaluations,
function_call_failed,Metric,Count of instances where the bot failed to successfully execute required function calls during evaluations,
intent_incoherence_count,Metric,Count of instances where the bot incorrectly detected or failed to detect user intent during evaluations,
Bot Performance Metrics,Category,"Collection of percentage-based metrics measuring different aspects of conversational bot failures including repetition, function failures, and intent detection issues",
Avg Empathy Score (synonyms: AVG Empathy Score),Metric / Calculated Field,"Average empathy score across conversations, converted to percentage scale (0-100), measuring how well the AI demonstrates emotional understanding and appropriate responsiveness to customer emotions and concerns. This metric measures how empathetic the chatbot responses are, expressed as a percentage.",Average Empathy Score
Avg Resolution Achieved (AVG Resolution Achieved),Metric / Calculated Field,"Average resolution achievement score across all evaluations/sessions, converted to percentage format by multiplying the base average by 100. Measures how effectively customer issues are resolved and represents the average resolution achievement rate across all assessments.","Average Resolution Achieved, Average Resolution Achievement Rate"
Avg Response Relevance (also: AVG Response Relevance),Metric / Calculated Field,"Average response relevance score across all evaluations, converted to percentage format by multiplying the base average by 100. Measures how relevant and appropriate bot responses are to user queries and customer inquiries.","Avg Response Relevance Score, Average Response Relevance, Average Response Relevance Score"
Soundbox Evaluation,Category,"Evaluation system for soundbox and AI bot customer service interactions, tracking quality metrics across multiple performance dimensions.",
Happy Feedback,Metric,Total count of positive customer feedback responses received during sessions.,
Sad Feedback,Metric,Total count of negative customer feedback responses received during sessions.,
Feedback Rate %,Metric / Calculated Field,"Percentage of active sessions that resulted in customer feedback, calculated as (Happy Feedback + Sad Feedback) * 100 / Active Sessions.",
Agent Handover %,Metric / Calculated Field,"Percentage of active sessions that were escalated to human agents, calculated as Agent Tickets * 100 / Active Sessions","Agent Handover Rate, AH %"
Service Ticket %,Metric / Calculated Field,"Percentage of active sessions that resulted in service ticket creation, calculated as Service Tickets * 100 / Active Sessions",
Final User Sentiment #,Category,"A grouping of metrics that tracks the count of users experiencing different types of sentiment changes, including neutral, positive, and negative changes.",
avg_empathy_score,Metric,"Base empathy score metric used in calculations, measuring empathy levels in customer service interactions before percentage conversion.",
avg_resolution_achieved,Metric,"Base resolution achieved metric from the database, representing raw resolution effectiveness scores before percentage conversion",
avg_response_relevance_score,Metric,"Base response relevance score metric from the soundbox evaluation data, used to calculate the average response relevance percentage",
MHD Evaluation Metrics,Category,"Collection of customer service evaluation metrics including empathy scores, resolution achievement, and response relevance used to assess service quality.",MHD Eval
AVG Eval Score,Metric / Calculated Field,"Average evaluation score across all sessions, expressed as percentage (Average of eval scores * 100)",Average Evaluation Score
+ve Sentiment Change %,Metric / Calculated Field,Percentage of positive user sentiment changes calculated as (Positive sentiment count / Total sentiment changes) * 100,"Positive Sentiment Change %, Positive Sentiment Change Rate"
AVG Topic Drift,Metric / Calculated Field,"Average topic drift score measuring how much conversations deviate from intended topics, expressed as percentage (Average of topic drift * 100)",Average Topic Drift Score
LLM L1 Metrics,Category,"Primary level metrics for Large Language Model evaluation including performance, quality, satisfaction, and failure indicators",LLM Level 1 Metrics
