term,type,definition,business_alias
MHD Evaluation,Category,Mental Health Detection evaluation process metrics including session analysis and completion tracking.,MHD Eval
MHD Overall Eval Summary,Category,"Summary metrics tracking the evaluation workflow including Active Sessions, Analyzed Sessions, Eval Completed, and their completion percentages",MHD Evaluation Metrics
Avg Empathy Score (synonyms: AVG Empathy Score),Metric / Calculated Field,"Average empathy score across conversations, converted to percentage scale (0-100), measuring how well the AI demonstrates emotional understanding and appropriate responsiveness to customer emotions and concerns. This metric measures how empathetic the chatbot responses are, expressed as a percentage.",Average Empathy Score
Avg Resolution Achieved (AVG Resolution Achieved),Metric / Calculated Field,"Average resolution achievement score across all evaluations/sessions, converted to percentage format by multiplying the base average by 100. Measures how effectively customer issues are resolved and represents the average resolution achievement rate across all assessments.","Average Resolution Achieved, Average Resolution Achievement Rate"
Avg Response Relevance,Metric / Calculated Field,"Average response relevance score across all evaluations, converted to percentage format by multiplying the base average by 100. Measures how relevant and appropriate bot responses are to user queries and customer inquiries.","Average Response Relevance, Avg Response Relevance Score, Average Response Relevance Score"
